{
  "schemaVersion": 1,
  "id": "inference-batch-scheduler",
  "version": 9,
  "promptFile": "prompt.md",
  "fixture": {
    "type": "directory",
    "path": "fixture"
  },
  "policy": {
    "network": "deny",
    "subagents": "deny",
    "allowedTools": [
      "read",
      "edit",
      "write",
      "bash",
      "grep",
      "find",
      "ls"
    ],
    "allowedChangedPaths": [
      "src/scheduler.mjs"
    ]
  },
  "limits": {
    "timeoutMs": 3600000,
    "checkTimeoutMs": 30000,
    "scorerTimeoutMs": 30000,
    "maxBashTimeoutSeconds": 60
  },
  "checks": {
    "public": [
      "npm test",
      "npm run evaluate -- --json"
    ],
    "privateScorer": "../../scorers/private/inference-batch-scheduler.mjs"
  },
  "metrics": {
    "primary": "normalizedQuality",
    "secondary": [
      "deadlineUtility",
      "computeEfficiency",
      "invalidBatches",
      "outputTokens"
    ]
  }
}
